{
  "slug": "greenconseil-v2",
  "name": "GREEN Conseil",
  "brandColor": "#00A651",
  "hero": {
    "image": "/hero-greenconseil.jpg",
    "imageAlt": "GREEN Conseil - équipe de consultants",
    "headline": {
      "line1": "Cabinet de conseil en",
      "line2": "transformation digitale",
      "line3": "et organisationnelle."
    },
    "subheadline": "Depuis 2015, nous accompagnons entreprises et fédérations sportives dans leurs projets de transformation. Certifiés QUALIOPI,",
    "subheadlineBold": "experts en Contract Management.",
    "ctaText": "Discuter de votre projet",
    "badge1": "+400 missions\nréalisées",
    "badge2": "98,3% de satisfaction\nformation",
    "cardTitle": "N°1 Contract Management",
    "cardSubtitle": "Projets juridiques informatisés",
    "caption": "Experts en transformation digitale"
  },
  "navigation": {
    "logoText": "GREEN Conseil",
    "logoImage": "/logo.svg",
    "navLinks": [
      { "label": "Nos expertises", "href": "#expertises" },
      { "label": "Notre méthode", "href": "#methode" },
      { "label": "Contact", "href": "#contact" }
    ],
    "ctaText": "Discuter de votre projet"
  },
  "services": {
    "sectionLabel": "Nos Expertises",
    "headline": "4 Business Units pour accompagner votre transformation",
    "headlineHighlight": "de la stratégie à la mise en œuvre.",
    "benefitsTitle": "Pourquoi GREEN Conseil ?",
    "benefits": [
      {
        "title": "Indépendance",
        "description": "Cabinet indépendant à taille humaine, sans conflit d'intérêt. Approche partenariale sur le long terme."
      },
      {
        "title": "Expertise reconnue",
        "description": "+400 missions réalisées depuis 2015. Références probantes auprès de grandes organisations."
      },
      {
        "title": "Approche terrain",
        "description": "Du conseil à la mise en œuvre. Nous restons à vos côtés pendant le déploiement, pas juste en phase de diagnostic."
      }
    ],
    "items": [
      {
        "id": "relation-client",
        "icon": "Users",
        "image": "/service-digital.jpg",
        "title": "Relation Client & Digital",
        "description": "Transformer votre expérience client en levier de compétitivité. Parcours multicanaux et transformation digitale.",
        "cta": "En savoir plus"
      },
      {
        "id": "sport",
        "icon": "Trophy",
        "image": "/service-sport.jpg",
        "title": "Monde du Sport",
        "description": "Accompagner les fédérations sportives dans leurs mutations. Modernisation SI et industrialisation des métiers DTN.",
        "cta": "En savoir plus"
      },
      {
        "id": "contract",
        "icon": "FileText",
        "image": "/service-juridique.jpg",
        "title": "Sphère Juridique",
        "description": "Optimiser la valeur de vos contrats par le Contract Management. N°1 des facilitateurs de projets juridiques informatisés.",
        "cta": "En savoir plus"
      },
      {
        "id": "formation",
        "icon": "GraduationCap",
        "image": "/service-formation.jpg",
        "title": "Formation sur mesure",
        "description": "Monter en compétences avec des formations opérationnelles. Certifié QUALIOPI, 98,3% de satisfaction.",
        "cta": "En savoir plus"
      }
    ]
  },
  "valueProposition": {
    "headline": "Une approche partenariale, de la stratégie à l'implémentation",
    "subheadline": "Ce qui nous différencie : une expertise concrète, des méthodologies reconnues, et un accompagnement sur-mesure.",
    "features": [
      {
        "icon": "Compass",
        "title": "Expertise terrain",
        "description": "Du conseil à la mise en œuvre opérationnelle. Nous accompagnons nos clients sur toute la chaîne de valeur, pas seulement en phase de recommandation."
      },
      {
        "icon": "Target",
        "title": "Contract Management",
        "description": "Reconnus comme n°1 des facilitateurs de projets juridiques à coloration informatique. Notre formation AFEST est la première de France sur catalogue."
      },
      {
        "icon": "Award",
        "title": "Certification QUALIOPI",
        "description": "Notre organisme de formation est certifié QUALIOPI avec un taux de satisfaction de 98,3%. Garantie de qualité pour vos parcours de formation."
      },
      {
        "icon": "Users",
        "title": "Partenariats solides",
        "description": "Collaborations établies avec PBZ Avocat, Lefebvre Dalloz et Francis Lefèbvre Formation pour une offre complète et crédible."
      }
    ]
  },
  "methodology": {
    "sectionLabel": "Notre méthode",
    "headline": "Notre méthode en 4 étapes.",
    "variant": "checklist",
    "steps": [
      {
        "number": "1",
        "icon": "Search",
        "title": "Diagnostic et compréhension",
        "description": "Nous commençons par une analyse approfondie de votre contexte, vos enjeux et votre maturité sur le sujet."
      },
      {
        "number": "2",
        "icon": "Map",
        "title": "Conception et co-construction",
        "description": "Nous élaborons avec vous les solutions adaptées à votre culture d'entreprise et vos contraintes opérationnelles."
      },
      {
        "number": "3",
        "icon": "Users",
        "title": "Accompagnement au déploiement",
        "description": "Nous restons à vos côtés pendant la mise en œuvre : formation, documentation, suivi des indicateurs."
      },
      {
        "number": "4",
        "icon": "LineChart",
        "title": "Évaluation et pérennisation",
        "description": "Nous mesurons les résultats et accompagnons la montée en autonomie de vos équipes."
      }
    ],
    "checklistItems": [
      "Diagnostic approfondi",
      "Solutions co-construites",
      "Déploiement terrain",
      "Pérennisation"
    ]
  },
  "partnersMarquee": [
    "Contract Management",
    "Transformation digitale",
    "QUALIOPI",
    "Fédérations sportives",
    "Relation client",
    "Formation"
  ],
  "contact": {
    "sectionLabel": "Contact",
    "headline": "Parlons de votre projet",
    "intro": "Vous avez un projet de transformation ? Une expertise à mobiliser ?",
    "introBold": "Premier échange gratuit pour évaluer vos besoins."
  },
  "footer": {
    "description": "Cabinet de conseil en transformation digitale et organisationnelle. N°1 Contract Management.",
    "copyright": "GREEN Conseil"
  }
}
