{
  "slug": "acfaty",
  "name": "Acfaty",
  "brandColor": "#0065c2",
  "hero": {
    "image": "/hero-acfaty.jpg",
    "imageAlt": "Chauffeur professionnel VTC - Acfaty",
    "headline": {
      "line1": "Créez votre",
      "line2": "entreprise de transport",
      "line3": "en toute sérénité."
    },
    "subheadline": "VTC, Taxi, transport de personnes : nous vous accompagnons de l'idée à l'exploitation.",
    "subheadlineBold": "Expertise réglementaire pointue",
    "ctaText": "Prendre rendez-vous",
    "badge1": "Expertise\nréglementaire",
    "badge2": "VTC · Taxi\nTransport",
    "cardTitle": "Accompagnement complet",
    "cardSubtitle": "De la création à l'exploitation",
    "caption": "Premier rendez-vous gratuit et sans engagement"
  },
  "navigation": {
    "logoText": "Acfaty",
    "navLinks": [
      { "label": "Nos accompagnements", "href": "#expertises" },
      { "label": "Notre méthode", "href": "#methodologie" },
      { "label": "Contact", "href": "#contact" }
    ],
    "ctaText": "Prendre rendez-vous"
  },
  "services": {
    "sectionLabel": "Nos Accompagnements",
    "headline": "Créez votre entreprise de transport",
    "headlineHighlight": "en toute sérénité.",
    "benefitsTitle": "Pourquoi Acfaty ?",
    "benefits": [
      {
        "title": "Spécialiste du transport",
        "description": "Expertise exclusive du secteur VTC, Taxi et transport de personnes. Pas de généraliste."
      },
      {
        "title": "Connaissance réglementaire",
        "description": "Maîtrise parfaite de la Loi Granguillaume, ADS, cartes professionnelles, capacité de transport."
      },
      {
        "title": "Accompagnement humain",
        "description": "Pas de plateforme automatisée. Un conseiller dédié qui suit votre dossier de A à Z."
      }
    ],
    "items": [
      {
        "id": "vtc",
        "icon": "Car",
        "image": "/service-vtc.jpg",
        "title": "Création entreprise VTC",
        "description": "Devenez chauffeur VTC en maîtrisant toutes les étapes réglementaires. Formation obligatoire, examen, immatriculation au registre des VTC, choix du statut juridique.",
        "cta": "En savoir plus"
      },
      {
        "id": "taxi",
        "icon": "Bus",
        "image": "/service-taxi.jpg",
        "title": "Création entreprise Taxi",
        "description": "Exercez la profession de taxi avec toutes les autorisations requises. Carte professionnelle, ADS (Autorisation de Stationnement), mise en conformité.",
        "cta": "En savoir plus"
      },
      {
        "id": "juridique",
        "icon": "Scale",
        "image": "/service-juridique.jpg",
        "title": "Conseil juridique et statut",
        "description": "Choisissez la forme juridique adaptée à votre projet. Microentreprise, SASU, SARL, EURL. Analyse comparative et accompagnement aux formalités.",
        "cta": "Choisir mon statut"
      }
    ]
  },
  "valueProposition": {
    "headline": "Un accompagnement complet pour créer votre entreprise",
    "subheadline": "Le secteur du transport est réglementé et complexe. Notre expertise vous guide à travers les démarches.",
    "features": [
      {
        "icon": "Shield",
        "title": "Expertise réglementaire",
        "description": "Maîtrise parfaite de la Loi Granguillaume, ADS, cartes professionnelles, capacité de transport."
      },
      {
        "icon": "FileCheck",
        "title": "Dossiers complets",
        "description": "Constitution rigoureuse de tous les dossiers administratifs pour maximiser vos chances d'acceptation."
      },
      {
        "icon": "Users",
        "title": "Accompagnement humain",
        "description": "Un conseiller dédié qui suit votre projet de A à Z. Pas de plateforme automatisée impersonnelle."
      },
      {
        "icon": "Route",
        "title": "De l'idée à l'exploitation",
        "description": "Nous vous accompagnons à chaque étape : formation, examens, immatriculation, choix du véhicule."
      }
    ]
  },
  "methodology": {
    "sectionLabel": "Notre Méthode",
    "headline": "Comment nous travaillons",
    "variant": "standard",
    "steps": [
      {
        "number": "01",
        "icon": "Search",
        "title": "Audit de votre projet",
        "description": "Nous analysons votre situation personnelle (permis, casier judiciaire, expérience), votre projet professionnel et vos contraintes pour identifier la meilleure voie d'accès."
      },
      {
        "number": "02",
        "icon": "ClipboardList",
        "title": "Plan d'action",
        "description": "Nous établissons un plan détaillé : étapes administratives, formations à suivre, délais, budget prévisionnel. Vous savez exactement où vous allez."
      },
      {
        "number": "03",
        "icon": "HandshakeIcon",
        "title": "Accompagnement opérationnel",
        "description": "Nous vous accompagnons dans la réalisation concrète : constitution des dossiers, préparation aux examens, relations avec les administrations."
      },
      {
        "number": "04",
        "icon": "Rocket",
        "title": "Lancement et suivi",
        "description": "Nous restons à vos côtés pour les premiers pas : mise en conformité finale, conseils de démarrage, questions post-création."
      }
    ]
  },
  "partnersMarquee": [
    "VTC",
    "Taxi",
    "Transport de personnes",
    "Loi Granguillaume",
    "ADS",
    "Carte professionnelle",
    "Capacité de transport"
  ],
  "contact": {
    "sectionLabel": "Contact",
    "headline": "Parlons de votre projet",
    "intro": "Vous souhaitez devenir VTC ou Taxi ? Vous avez besoin d'accompagnement pour créer votre entreprise de transport ?",
    "introBold": "Prenons le temps d'échanger sur votre projet. Le premier rendez-vous de diagnostic est gratuit et sans engagement.",
    "email": "contact@acfaty.fr",
    "phone": "+33 (0)X XX XX XX XX"
  },
  "footer": {
    "description": "Cabinet conseil spécialisé dans l'accompagnement à la création d'entreprises VTC, Taxi et transport de personnes.",
    "copyright": "Acfaty"
  }
}
